Question,Category,Difficulty,Answer
"The anime Attack on Titan was directed by Tetsurō Araki, the same person who directed the anime Highschool of the Dead.",Entertainment: Japanese Anime & Manga,medium,True
"In Star Trek, who was the founder of the Klingon Empire and its philosophy?",Entertainment: Television,hard,Kahless the Unforgettable
What is the name of the only remaining Grand Duchy in the world ?,Geography,medium,Luxembourg
What year did the anime Himouto! Umaru-chan air?,Entertainment: Japanese Anime & Manga,medium,2015
"In DuckTales, what is the name of the city where all the main characters live?",Entertainment: Television,easy,Duckburg
In what dialogue did Socrates defend himself to the court of Athens? ,History,medium,The Apology
What is the correct term for the metal object in between the CPU and the CPU fan within a computer system?,Science: Computers,medium,Heat Sink
Which of these does Charlie NOT read in The Perks of Being a Wallflower?,Entertainment: Books,hard,The Grapes of Wrath
The Second Boer War in 1899 was fought where?,History,hard,South Africa
"In Until Dawn, both characters Sam and Mike cannot be killed under any means until the final chapter of the game.",Entertainment: Video Games,easy,True
"What is the name of Team Fortress 2 update, in which it became Free-to-play?",Entertainment: Video Games,easy,Über Update
How many Harry Potter books are there?,Entertainment: Books,easy,7
In which series of games do you collect souls to empower you and buy weaponry and armor with?,Entertainment: Video Games,easy,Souls
Which Canadian province has Charlottetown as its capital?,Geography,medium,Prince Edward Island
Who is One Punch Man voiced by in the Japanese version.,Entertainment: Japanese Anime & Manga,hard,Makoto Furukawa
"What genre of EDM is the Dutch DJ, musician, and remixer Armin van Buuren most well-known for?",Entertainment: Music,medium,Trance
Which of these is NOT a faction included in the game Counter-Strike: Global Offensive?,Entertainment: Video Games,medium,BOPE
"In the TV show Mad Men, what was Donald Drapers birthname?",Entertainment: Television,easy,Richard Dick Whitman
How many officially recognized dwarf planets in the solar system are named after Polynesian deities?,Science & Nature,medium,2
Which city hosted the CS:GO Dreamhack Open 2015?,Entertainment: Video Games,medium,Cluj-Napoca
"In To Love-Ru: Darkness, which of the girls attempt making a harem for Rito Yuuki?",Entertainment: Japanese Anime & Manga,medium,Momo Deviluke
"In Dead Space 2, the Hand Cannon is a large foam finger.",Entertainment: Video Games,easy,True
Gannymede is the largest moon of which planet?,Science & Nature,medium,Jupiter
"In AMCs The Walking Dead, the characters Rick, Carl, Daryl, Morgan, Carol and Maggie were introduced in Season 1.",Entertainment: Television,medium,False
What is the first track on Kanye Wests 808s & Heartbreak?,Entertainment: Music,medium,Say You Will
Which actor and martial artist starred as Colonel Guile in the 1994 action film adaptation of Street Fighter?,Entertainment: Film,medium,Jean-Claude Van Damme
What animal takes part in Schrödingers most famous thought experiment?,Science & Nature,easy,Cat
What company created and developed the game Overwatch?,Entertainment: Video Games,easy,Blizzard Entertainment
In the anime Assassination Classroom what is the class that Korosensei teaches?,Entertainment: Japanese Anime & Manga,medium,Class 3-E
"The Whos eponymous line, Teenage Wasteland, appears in which of their songs?",Entertainment: Music,medium,Baba O Riley
The heavy metal band Black Sabbath hail from which English city?,Entertainment: Music,hard,Birmingham
Which year was the album Floral Shoppe by Macintosh Plus released?,Entertainment: Music,hard,2011
"In Team Fortress 2, what is the fastest taunt kill that can be pulled off?",Entertainment: Video Games,hard,Showdown
Time on Computers is measured via the EPOX System.,Science: Computers,easy,False
Tokyo is the capital of Japan.,Geography,easy,True
Which one of these tanks was designed and operated by the United Kingdom?,History,easy,Tog II
Who plays Jack Burton in the movie Big Trouble in Little China?,Entertainment: Film,easy,Kurt Russell
What is Doug Walkers YouTube name?,Celebrities,medium,The Nostalgia Critic
"3 members of 2 Live Crew were arrested for playing songs from their album, As Nasty As They Wanna Be, live.",Entertainment: Music,medium,True
Which of the following Mesopotamian mythological figures was NOT a deity?,Mythology,medium,Enkidu
What is the name of the protagonists first Persona in Persona 5?,Entertainment: Video Games,medium,Arsene
"What are the Three Virtues of Bionicle?,Entertainment: Comics,hard",Unity, Duty, Destiny
"In the cartoon SpongeBob SquarePants, what did the acronym E.V.I.L stand for?",Entertainment: Television,easy,Every Villain Is Lemons
The minigun was designed in 1960 by which manufacturer.,History,medium,General Electric
Liechtenstein does not have an airport.,Geography,medium,True
In which year did the British television series The Bill end?,Entertainment: Television,medium,2010
Which Toronto landmark was featured on the cover art of Canadian rapper Drakes 2016 album Views?,Entertainment: Music,medium,CN Tower
"In Need For Speed Most Wanted (2005), what do you drive at the beginning of the career mode?",Entertainment: Video Games,medium,BMW M3 GTR
What was the first weapon pack for PAYDAY 2?,Entertainment: Video Games,medium,The Gage Weapon Pack #1
"In vanilla Minecraft, which of the following cannot be made into a block?",Entertainment: Video Games,easy,Charcoal
The default playermodel of Garrys Mod is this Half Life 2 character.,Entertainment: Video Games,medium,Isaac Kleiner
Which English county will you find the University of East Anglia?,Geography,medium,Norfolk
"In the comic book Archie, Betty is friends with Veronica because she is rich.",Entertainment: Comics,hard,False
"The coat of arms of the King of Spain contains the arms from the monarchs of Castille, Leon, Aragon and which other former Iberian kingdom?",History,hard,Navarre
"In the 2015 RPG Undertale, which character do you first encounter after falling down into the underground?",Entertainment: Video Games,medium,Flowey
What does the S in the RSA encryption algorithm stand for?,Science: Computers,medium,Shamir
"In the Season 1 SpongeBob Squarepants episode, Help Wanted, the song Living in the Sunlight by Tiny Tim can be heard.",Entertainment: Television,easy,True
Which kind of algorithm is Ron Rivest not famous for creating?,Science: Computers,hard,Secret sharing scheme
Drink the Sea is an album by which electronic music artist?,Entertainment: Music,medium,The Glitch Mob
"In Youtuber Jerma985s 2014 film Rat Movie: Mystery of the Mayan Treasure, who is the man who tries to steal the Mayan Treasure?",Entertainment: Film,hard,Dick Dastardly Richards
What was the title of Sakamoto Kyus song Ue o Muite Arukou (I Look Up As I Walk) changed to in the United States?,Entertainment: Music,medium,Sukiyaki
Which company did Gabe Newell work at before founding Valve Corporation?,Entertainment: Video Games,easy,Microsoft
"In 2008, British celebrity chef Gordon Ramsay believes he almost died after suffering what accident in Iceland while filming?,Entertainment: Television",hard,Slipping off a cliff, and nearly drowning in icy water
What is the name of the talking cat in Persona 5?,Entertainment: Video Games,easy,Morgana
How many French Opens did Björn Borg win?,Sports,medium,6
Which of these online games was originally named LindenWorld in its early development?,Entertainment: Video Games,hard,SecondLife
In what year was the game Fallout released?,Entertainment: Video Games,easy,1997
"Bugs Bunny, Tony the Tiger, and other bipedal animal characters are known as what type of character?",Entertainment: Cartoon & Animations,medium,Anthropomorphic
"All of these maps were in Tom Clancys Rainbow Six Siege on its initial release: House, Clubhouse, Border, Consulate.",Entertainment: Video Games,hard,False
Adolf Hitler was a german soldier in World War I.,History,easy,True
What is the capital of Peru?,Geography,medium,Lima
Who wrote the childrens story The Little Match Girl?,Entertainment: Books,medium,Hans Christian Andersen
What scientific family does the Aardwolf belong to?,Animals,hard,Hyaenidae
"In JoJos Bizarre Adventure: Stardust Crusaders, what is the last name of the protagonist Jotaro?",Entertainment: Japanese Anime & Manga,medium,Kujo
What does SSD stand for in the context of computer storage?,Science: Gadgets,easy, Solid State Drive
Which race in Guild Wars 2 believes in the Eternal Alchemy?,Entertainment: Video Games,easy,Asura
Who directed the movie Alien?,Entertainment: Film,medium,Ridley Scott
Which student in Yandere Simulator is known for asking irritating and stupid questions?,Entertainment: Video Games,easy,Midori Gurin
Which Audi does not use Haldex based all wheel drive system?,Vehicles,hard,Audi A8
"In the Scoville scale, what is the hottest chemical?",Science & Nature,hard,Resiniferatoxin
Which of these is NOT an Australian state or territory?,Geography,easy,Alberta
Which of these European cities was the first to host the modern Summer Olympic Games three times?,Sports,hard,London
What is the right way to spell the capital of Hungary?,Geography,medium,Budapest
All of the following are classified as Finno-Ugric languages EXCEPT:,Geography,easy,Samoyedic
In which game did the Konami Code make its first appearance?,Entertainment: Video Games,medium,Gradius
"When was the Declaration of Independence approved by the Second Continental Congress?,General Knowledge",medium,July 4, 1776
"Which of these American cities has fewer than 1,000,000 people?,Geography",medium,San Francisco, California
What was the third country to have a McDonalds restaurant?,General Knowledge,hard,Costa Rica
Which of the following bones is not in the leg?,Science & Nature,easy,Radius
How many regular Sunken Sea Scrolls are there in Splatoon?,Entertainment: Video Games,medium,27
Bulls are attracted to the color red.,General Knowledge,easy,False
"In the web-comic Homestuck, what is the name of the game the 4 kids play?",Entertainment: Cartoon & Animations,hard,Sburb
When was the first mammal successfully cloned?,Science & Nature,medium,1996
"In the Team Fortress 2 canon, what did Shakespearicles NOT invent?",Entertainment: Video Games,hard,Stairs
"In the Dungeons and Dragons universe, Beshaba is the deity of bad luck. ",Entertainment: Board Games,easy,True
Which of these artists did NOT feature in the fitfh studio album Humanz by British virtual band Gorillaz?,Entertainment: Music,hard,Snoop Dogg
Neptunes greek name was...,Mythology,medium,Poseidon
What is the code name of Morgana the cat in Persona 5?,Entertainment: Video Games,easy,Mona
"Unix Time is defined as the number of seconds that have elapsed since when?,Science: Computers,medium",Midnight, January 1, 1970
What video game engine does the videogame Quake 2 run in?,Entertainment: Video Games,easy,iD Tech 2
What is the name of the machine that fails and essentially dooms mankind in the beginning of the first Half-Life game?,Entertainment: Video Games,medium,Anti-mass spectrometer
"In the Sailor Moon series, what is Sailor Jupiters civilian name?",Entertainment: Japanese Anime & Manga,medium,Makoto Kino
Which English king was married to Eleanor of Aquitaine?,History,hard,Henry II
Who is the leader of Team Instinct in Pokémon Go?,Entertainment: Video Games,easy,Spark
"In flight systems, what does the initialism TCAS stand for?",General Knowledge,hard,Traffic Collision Avoidance System
Which of the following is NOT a work done by Shakespeare?,Entertainment: Books,hard,Trial of Temperance
Some people call me the space cowboy is the first line from what song?,Entertainment: Music,easy,The Joker
Which company designed the Betamax video cassette format?,Science: Gadgets,medium,Sony
"Spoon theory is a theory, utilizing Spoons as a metaphor for energy they can use in a day.",General Knowledge,hard,True
Which modern day country is the region that was known as Phrygia in ancient times?,History,easy,Turkey
One of Barack Obamas United States presidential campaign slogans was Yes We Can.,Politics,easy,True
"If you planted the seeds of Quercus robur, what would grow?",General Knowledge,hard,Trees
Which fictional English county was the setting for Thomas Hardys novels?,Entertainment: Books,hard,Wessex
What is the lowest amount of max health you can have in Team Fortress 2?,Entertainment: Video Games,medium,70
Which of these game-based comics were published in 2011 by DC Comics?,Entertainment: Comics,medium,Infamous
"In past times, what would a gentleman keep in his fob pocket?",General Knowledge,easy,Watch
"In the alternate timeline in Mortal Kombat, which character was the one to slaughter the Shirai Ryu clan?",Entertainment: Video Games,hard,Quan Chi
What is the 4th boss in the 1997 video game Crash Bandicoot 2: Cortex Strikes Back?,Entertainment: Video Games,hard,Dr. N. Gin
"In the Harry Potter series, what is Headmaster Dumbledores full name?",Entertainment: Books,hard,Albus Percival Wulfric Brian Dumbledore
The phrase accident waiting to happen is an example of what type of figure of speech?,General Knowledge,medium,Idiom
Metal Gear Solid 3: Snake Eater was released in 2004.,Entertainment: Video Games,easy,True
"In Super Mario Bros., who informs Mario that the princess is in another castle?",Entertainment: Video Games,easy,Toad
What breed of dog is Scooby Doo?,Entertainment: Television,medium,Great Dane
Which one of these scientists conducted the Gold Foil Experiment which concluded that atoms are mostly made of empty space?,Science & Nature,medium,Ernest Rutherford
Which of these Roman gods doesnt have a counterpart in Greek mythology?,Mythology,medium,Janus
Which item of clothing is usually worn by a Scotsman at a wedding?,General Knowledge,medium,Kilt
What were the Chilled Monkey Brains made from during Indiana Jones and the Temple of Doom?,Entertainment: Film,medium,Custard and Raspberry Sauce
The first dual-core CPU was the Intel Pentium D.,Science: Computers,medium,False
"What was the development code name for the Urzas Destiny expansion for Magic: The Gathering, released in 1999?",Entertainment: Board Games,hard,Chimichanga
Which of the following is not a playable race in the MMORPG Guild Wars 2? ,Entertainment: Video Games,medium,Tengu
Who won the 2015 Formula 1 World Championship?,Sports,easy,Lewis Hamilton
"In Left 4 Dead, what is the name of the Special Infected that is unplayable in Versus mode?",Entertainment: Video Games,medium,The Witch
On which Beatles album would you find the song Eleanor Rigby?,Entertainment: Music,hard,Revolver
An organism described as heliotropic has a tendancy to move towards which of these things?,Science & Nature,medium,Light
"In the anime Black Butler, who is betrothed to be married to Ciel Phantomhive?",Entertainment: Japanese Anime & Manga,easy,Elizabeth Midford
"In 2016, the IUCN reclassified the status of Giant Pandas from endangered to vulnerable.",Animals,easy,True
Nvidias headquarters are based in which Silicon Valley city?,Science: Computers,medium,Santa Clara
What is the longest river in Europe?,Geography,medium,Volga
Which of these is NOT a part of the structure of a typical neuron?,Science & Nature,medium,Islets of Langerhans
Approximately what percentage of Earths atmosphere is Oxygen?,Science & Nature,medium,21%
The names of Tom Nooks cousins in the Animal Crossing franchise are named Timmy and Jimmy.,Entertainment: Video Games,easy,False
"In the Monster Hunter Series, it is possible to capture Elder Dragons.",Entertainment: Video Games,easy,False
"Which American-owned brewery led the country in sales by volume in 2015?,General Knowledge",easy,D. G. Yuengling and Son, Inc
What model was the sports car gifted to Yuri Gagarin by the French government in 1965?,Vehicles,hard,Matra Djet
Zero factorial is equal to zero. ,Science: Mathematics,medium,False
What round is a classic AK-47 chambered in?,Science: Gadgets,easy,7.62x39mm
In which British seaside town was the BBC sitcom Fawlty Towers set?,Entertainment: Television,easy,Torquay
What are Panama hats made out of?,General Knowledge,easy,Straw
Bill Cipher in the show Gravity Falls is the good guy.,Entertainment: Cartoon & Animations,easy,False
Who wrote the Sinead O`Connor hit Nothing Compares 2 U?,Entertainment: Music,easy,Prince
Rabbits cant vomit.,Animals,easy,True
"In the show, Doctor Who, what does T.A.R.D.I.S stand for?",Entertainment: Television,easy,Time And Relative Dimensions In Space
What country joined the EU in 2013?,History,easy,Croatia
"After the 1516 Battle of Marj Dabiq, the Ottoman Empire took control of Jerusalem from which sultanate?",History,hard,Mamluk
What is the scientific name of the Budgerigar?,Animals,hard,Melopsittacus undulatus
Pete Townshend collaborated with which famous guitarist for an event at Brixton Academy in 1985?,Entertainment: Music,hard,David Gilmour
Who designed the Chupa Chups logo?,Art,medium,Salvador Dali
There are 86400 seconds in a day.,General Knowledge,medium,True
Rhinoplasty is a surgical procedure on what part of the human body?,Science & Nature,easy,Nose
Which actress married Michael Douglas in 2000?,Celebrities,easy,Catherine Zeta-Jones
What was the punishment for Sysiphuss craftiness?,Mythology,hard,Cursed to roll a boulder up a hill for eternity.
"In the Half-Life series, H.E.V stands for Hazardous Evasiveness Vest",Entertainment: Video Games,easy,False
Which country is singer Kyary Pamyu Pamyu from?,Entertainment: Music,medium,Japan
Earl Grey tea is black tea flavoured with what?,General Knowledge,medium,Bergamot oil
How many books are in the Chronicles of Narnia series?,Entertainment: Books,medium,7
"Kraft Cheez Whiz contains cheese culture, but doesnt actually contain cheese",General Knowledge,medium,True
"The computer OEM manufacturer Clevo, known for its Sager notebook line, is based in which country?",Science: Computers,medium,Taiwan
How many dots are on a single die?,Entertainment: Board Games,easy,21
The vapor produced by e-cigarettes is actually water.,General Knowledge,medium,False
El Niño pushes warm water to the coasts of the Western Pacific during winter.,Science & Nature,medium,True
Painter Piet Mondrian (1872 - 1944) was a part of what movement?,Art,hard,Neoplasticism
What year did Attack on Titan first air?,Entertainment: Japanese Anime & Manga,easy,2013
"In the 2012 animated film Wolf Children, what are the names of the wolf children?",Entertainment: Japanese Anime & Manga,easy,Ame & Yuki
What is Lilos last name from Lilo and Stitch?,Entertainment: Film,medium,Pelekai
"Linus Pauling, one of the only winners of multiple Nobel Prizes, earned his Nobel Prizes in Chemistry and what?",General Knowledge,medium,Peace
Gannymede is the largest moon of which planet?,Science & Nature,medium,Jupiter
"In Marvel Comics, Taurus is the founder and leader of which criminal organization?",Entertainment: Comics,medium,Zodiac
Who was Tetris created by?,Entertainment: Video Games,medium,Alexey Pajitnov
"In baseball, how many fouls are an out?",Sports,easy,0
"In Calvin and Hobbes, what is the name of Susies stuffed rabbit?",Entertainment: Comics,medium,Mr. Bun
What was the major distinction between the English and French Gothic styles of architecture?,Art,hard,Fan vaulting
How many aces can be shot down through the entirety of Ace Combat Zero: The Belkan War?,Entertainment: Video Games,hard,169
Which fictional English county was the setting for Thomas Hardys novels?,Entertainment: Books,hard,Wessex
Which of the following guitarists recorded an album as a member of the Red Hot Chili Peppers?,Entertainment: Music,medium,Dave Navarro
A cancelled Call Of Duty title would have taken place in ancient Rome.,Entertainment: Video Games,medium,True
How many players are there in an association football/soccer team?,Sports,easy,11
"In Battlestar Galactica (2004), what is the name of the President of the Twelve Colonies?",Entertainment: Television,medium,Laura Roslin
"In the video game franchise Halo, what is the UNSCs main opposing faction called?",Entertainment: Video Games,easy,The Covenant
"In Call of Duty: United Offensive, what two soldiers share a name of a video game character?",Entertainment: Video Games,medium,Gordon & Freeman
Who was given the title Full Metal in the anime series Full Metal Alchemist?,Entertainment: Japanese Anime & Manga,easy,Edward Elric
How many legs is it biologically impossible for a centipede to have?,Science & Nature,hard,100
Tony Hawks Pro Skater was released in 1999.,Entertainment: Video Games,medium,True
The Spitfire originated from a racing plane.,History,easy,True
Who is Soras Nobody in Kingdom Hearts?,Entertainment: Video Games,medium,Roxas
"Which puzzle game was designed by a Russian programmer, featuring Russian buildings and music?",Entertainment: Video Games,medium,Tetris
"Which video game was recalled for containing a hidden, playable South Park episode?",Entertainment: Video Games,hard,Tiger Woods 99 PGA Tour
"In the game Brawlhalla, what species is the character Bödvar is?",Entertainment: Video Games,medium,Half Human / Half Bear
"The British Rail Class 700, Class 707 and the Class 717 are part of what train family?",Vehicles,medium,Desiro City
Approximately how long is a year on Uranus?,Science & Nature,medium,84 Earth years
What scientific family does the Aardwolf belong to?,Animals,hard,Hyaenidae
In which U.S. state is Far Cry 5s fictional setting Hope County located?,Entertainment: Video Games,medium,Montana
What is the symbol for Displacement?,Science: Mathematics,easy,Δr
Which of these is NOT a team available in the game Pokémon Go?,Entertainment: Video Games,easy,Team Rocket
In what year was Pokémon Diamond & Pearl released in Japan?,Entertainment: Video Games,medium,2006
"Which of these bands was a featuring artist in Compton rapper Kendrick Lamars 2017 album, DAMN.?",Entertainment: Music,medium,U2
"In The Lies Of Locke Lamora, what does Lamora mean in Throne Therin?",Entertainment: Books,hard,Shadow
"What was the transfer of disease, crops, and people across the Atlantic shortly after the discovery of the Americas called?",History,medium,The Columbian Exchange
The book Fahrenheit 451 was written by whom?,Entertainment: Books,medium,Ray Bradbury
The surface area of Russia is slightly larger than that of the dwarf planet Pluto.,Geography,medium,True
Which element has the chemical symbol Fe?,Science & Nature,easy,Iron
Matt Damon played an astronaut stranded on an extraterrestrial planet in both of the movies Interstellar and The Martian.,Entertainment: Film,easy,True
Which of these characters is the mascot of the video game company SEGA?,Entertainment: Video Games,easy,Sonic the Hedgehog
What is the largest living species of penguin?,General Knowledge,easy,Emperor
"Joan Cusack starred in the 2009 disaster movie, 2012.",Entertainment: Film,medium,False
Ping-Pong originated in England,General Knowledge,easy,True
Which Roman Emperor led the Roman Empire to reach its maximum territorial extent?,History,medium,Trajan
"Minions was released on the June 10th, 2015.",Entertainment: Film,easy,False
"In the Seven Wonders of the World, which wonder is the only that has survived to this day?",History,hard,Great Pyramid of Giza
An organic compound is considered an alcohol if it has what functional group?,Science & Nature,hard,Hydroxyl
Which Swiss psychologist is synonymous with the concepts of introvert and extrovert personalities?,Science & Nature,medium,Carl Jung
"In Fairy Tail, what is the nickname of Natsu Dragneel?",Entertainment: Japanese Anime & Manga,easy,The Salamander
Unturned originally started as a Roblox game.,Entertainment: Video Games,hard,True
In Kingdom Hearts which of the following people can NOT wield a keyblade?,Entertainment: Video Games,medium,Larxene
In what year was the last natural case of smallpox documented?,History,medium,1977
"Which of these bands was a featuring artist in Compton rapper Kendrick Lamars 2017 album, DAMN.?",Entertainment: Music,medium,U2
"In Calvin and Hobbes, what is the name of the principal at Calvins school?",Entertainment: Comics,medium,Mr. Spittle
On the NBC show Community what was Star Burns real name?,Entertainment: Television,medium,Alex
Shaquille O’Neal has only made one three pointer in his career.,Sports,easy,True
"Which puzzle game was designed by a Russian programmer, featuring Russian buildings and music?",Entertainment: Video Games,medium,Tetris
Neptunes greek name was...,Mythology,medium,Poseidon
"Wendy O. Koopa appeared in the Super Mario DIC Cartoons, but what was she known as?",Entertainment: Cartoon & Animations,easy,Kootie Pie
The first televised presidential debate was between Jimmy Carter and Gerald Ford.,History,medium,False
"Between 1973 to 1990, what country was ruled by dictator Augusto Pinochet?",Politics,medium,Chile
Which Overwatch character says the line Heroes never die!?,Entertainment: Video Games,medium,Mercy
All of the following programs are classified as raster graphics editors EXCEPT:,Science: Computers,medium,Inkscape
"In the beginning of the game Sonic Adventure, what color Chaos Emerald does Tails own?",Entertainment: Video Games,medium,Purple
"During the events of Half-Life: Opposing Force, what is the age of Adrian Shephard, the protagonist?",Entertainment: Video Games,medium,22
"In Magic: The Gathering, what term for blocking was established in the Portal set?",Entertainment: Board Games,hard,Intercepting
The band STRFKR was also briefly known as Pyramiddd.,Entertainment: Music,hard,True
The 1985 Toyota Corolla AE86 was the hero car for what anime? ,Entertainment: Television,medium,Initial D
The “fairy” type made it’s debut in which generation of the Pokemon core series games?,General Knowledge,easy,6th
