Question,Category,Difficulty,Answer
What is radiation measured in?,Science & Nature,medium,Gray
"In the game Call of Duty, what is the last level where you play as an American soldier?",Entertainment: Video Games,hard,Festung Recogne
Which of these cities has a 4° East longitude. ,Geography,hard,Amsterdam
Grand Theft Autumn/Where Is Your Boy is a song by which band?,Entertainment: Music,medium,Fall Out Boy
Which naval battle was considered the turning point of the Pacific Ocean Theater during World War 2?,History,hard,Battle of Midway
Which souls game was not directed by Hidetaka Miyazaki?,Entertainment: Video Games,hard,Dark Souls 2
Mark Wahlberg played the titular character of which 2008 video-game adaptation?,Entertainment: Film,medium,Max Payne
Which of the following is a character in the video game Destiny?,Entertainment: Video Games,medium,Cayde-6
"In Greek Mythology, who was the daughter of King Minos?",Mythology,hard,Ariadne
"Which American celebrity died in 1977 playing golf in La Moraleja, Madrid?",Celebrities,medium,Bing Crosby
Who performed the opening theme song for the James Bond 007 movie Goldfinger?,Entertainment: Film,medium,Shirley Basey
"In the 2011 TV anime series, THE iDOLM@STER, what was the name of Ioris stuffed toy bunny?",Entertainment: Japanese Anime & Manga,medium,Charles
Metal Gear Solid 3: Snake Eater takes place on Shadow Moses Island.,Entertainment: Video Games,medium,False
Which of these countries is NOT a part of the Asian continent?,Geography,hard,Suriname
Who is the horror manga artist who made Uzumaki?,Entertainment: Japanese Anime & Manga,hard,Junji Ito
When someone is inexperienced they are said to be what color?,General Knowledge,easy,Green
"In most FPS video games such as Counter-Strike, shooting which part of the body does the highest damage?",Entertainment: Video Games,easy,Head
"In Terry Pratchetts Discworld novel Wyrd Sisters, which of these are not one of the three main witches?",Entertainment: Books,medium,Winny Hathersham
What is the name of Layer 7 of the OSI model?,Science: Computers,easy,Application
Which of the General Mills Corporations monster cereals was the last to be released in the 1970s?,General Knowledge,medium,Fruit Brute
"If soccer is called football in England, what is American football called in England?",Geography,easy,American football
How many dots are on a single die?,Entertainment: Board Games,easy,21
"Which of these words refers to something made, distributed, or sold illegally?",General Knowledge,easy,Bootleg
In what prison was Adolf Hitler held in 1924?,History,medium,Landsberg Prison
Which soccer player is featured on the cover of EA Sports FIFA 18?,Entertainment: Video Games,medium,Cristiano Ronaldo
"In season one of the US Kitchen Nightmares, Gordan Ramsay tried to save 10 different restaurants. How many ended up closing afterwards?",Entertainment: Television,hard,9
What is the Swedish word for window?,General Knowledge,medium,Fönster
"In the anime, Super Sonico, what is Super Sonicos favorite food?",Entertainment: Japanese Anime & Manga,medium,Macroons
"The first half-hour CGI cartoon, ReBoot, aired on which year?",Entertainment: Television,medium,1994
Otters have pockets under their arms for carrying their favourite snacks and rocks.,Animals,medium,True
"In Overwatch, Coalescence is the name for the ultimate of which hero?",Entertainment: Video Games,medium,Moira
Which of the following characters from the game Overwatch was revealed to be homosexual in December of 2016?,Entertainment: Video Games,easy,Tracer
Five dollars is worth how many nickels?,General Knowledge,easy,100
"In the original Super Mario Bros., what is the acceleration of Mario if he was in free fall?",Entertainment: Video Games,hard,91.28 m/s^2
How many playable characters are there in Super Smash Bros. for Nintendo 3DS and Wii U?,Entertainment: Video Games,hard,58
Which country does the band Rammstein hail from?,Entertainment: Music,easy,Germany
In the Overlord Anime who was Cocytus made by?,Entertainment: Japanese Anime & Manga,hard,Warrior Takemikazuchi
BMW M GmbH is a subsidiary of BMW AG that focuses on car performance.,Vehicles,easy,True
Myopia is the scientific term for which condition?,Science & Nature,medium,Shortsightedness
Pure water effectively conducts electricity ,General Knowledge,medium,False
Formula E is an auto racing series that uses hybrid electric race cars.,Sports,medium,False
What name is the main character Chihiro given in the 2001 movie Spirited Away?,Entertainment: Japanese Anime & Manga,easy,Sen (Thousand)
How many laws of thermodynamics are there?,Science & Nature,easy,Four
"What Touhou Project characters first ever appearance was as a midboss in the eighth game, Imperishable Night?",Entertainment: Video Games,hard,Tewi Inaba
"In Halo, what is the name of the planet which Installation 04 orbits?",Entertainment: Video Games,hard,Threshold
What does LTS stand for in the software market?,Science: Computers,easy,Long Term Support
In which mall does Dead Rising take place?,Entertainment: Video Games,easy,Willamette Parkview Mall
Which of the following physical typologies are used with Ethernet Networks?,Science: Computers,hard,Star
Who was the Prime Minister of Japan when Japan declared war on the US?,History,easy,Hideki Tojo
What was the first superhero film James Gunn was involved with?,Entertainment: Film,hard,The Specials
A scalene triangle has two sides of equal length.,Science: Mathematics,easy,False
"In The Binding of Isaac, what is the name of the final boss that you fight in The Void?",Entertainment: Video Games,medium,Delirium
What is the capital city of Slovenia?,Geography,medium,Ljubljana
"In Call Of Duty: Zombies, what is the name of the machine that upgrades weapons?",Entertainment: Video Games,easy,Pack-A-Punch
"Irish musician Hozier released a music track in 2013 titled, Take Me to ______",Entertainment: Music,medium,Church
Toby Foxs Megalovania was first used where?,Entertainment: Video Games,medium,Radiations Earthbound Halloween Hack
"In Undertale, having a Fun Value set to 56-57 will play the Wrong Number Song Call.",Entertainment: Video Games,hard,False
What airline was the owner of the plane that crashed off the coast of Nova Scotia in 1998?,General Knowledge,easy,Swiss Air
Which one of the first four titles of the Grand Theft Auto franchise started the series of iconic image grid cover arts?,Entertainment: Video Games,medium,Grand Theft Auto III
"The four strings on a violin are the G string, D string, A string, and...",Entertainment: Music,easy,E string
Which of the following is the oldest of these computers by release date?,Science: Computers,hard,TRS-80
Which two modern-day countries used to be known as the region of Rhodesia between the 1890s and 1980?,Geography,medium,Zambia & Zimbabwe
Who was the main developer of the Suez Canal?,History,medium,Ferdinand de Lesseps
"Switzerland has four national languages, English being one of them.",Geography,hard,False
Donkey Kong was originally set to be a Popeye arcade game.,Entertainment: Video Games,easy,True
Pointers were not used in the original C programming language; they were added later on in C++.,Science: Computers,easy,False
What album did Gorillaz release in 2017?,Entertainment: Music,medium,Humanz
"In the Doctor Who universe, how many times can a time lord normally regenerate?",Entertainment: Television,medium,12
What event marked the start of World War II?,History,medium,Invasion of Poland (1939)
What is the elemental symbol for mercury?,Science & Nature,easy,Hg
"According to their 1974 hit, what were Brownsville Station doing In The Boys Room?",Entertainment: Music,medium,Smokin
"What was Maggie Simpsons first canonical word, not including the Tracey Ullman shorts?",Entertainment: Cartoon & Animations,hard,Daddy.
Which African American is in part responsible for integrating  Major League baseball?,Sports,easy,Jackie Robinson
The General Motors EV1 was the first street-legal production electric vehicle.,Vehicles,medium,False
Which Twitch streamer is the vocalist for Red Vox?,Entertainment: Music,easy,Vinesauce
"All of these maps were in Tom Clancys Rainbow Six Siege on its initial release: House, Clubhouse, Border, Consulate.",Entertainment: Video Games,hard,False
"What name did Mario, from Super Mario Brothers, originally have?",Entertainment: Video Games,medium,Ossan
What was the main currency in Club Penguin?,Entertainment: Video Games,medium,Coins
What is the last name of the primary female protagonist of Final Fantasy VIII?,Entertainment: Video Games,easy,Heartilly
In which countrys version of Half-Life are the HECU Marines replaced with robots?,Entertainment: Video Games,medium,Germany
In which manga did the 404 Girl from 4chan originate from?,Entertainment: Japanese Anime & Manga,hard,Yotsuba&!
What is the name of the famous Apache leader who died in 1909 at the age of 70?,History,medium,Geronimo
"Samuel L. Jackson had the words, Bad Motherf*cker in-scripted on his lightsaber during the filming of Star Wars.",Entertainment: Film,easy,True
How many total monsters appear in Monster Hunter Generations?,Entertainment: Video Games,hard,105
"This element, when overcome with extreme heat and pressure, creates diamonds.",Science & Nature,easy,Carbon
"Snakes and lizards are known to flick their tongue, this behavior is to?",Animals,easy,Capture scent particles
Which river flows through the Scottish city of Glasgow?,General Knowledge,medium,Clyde
"In season one of the US Kitchen Nightmares, Gordan Ramsay tried to save 10 different restaurants. How many ended up closing afterwards?",Entertainment: Television,hard,9
What is the unit of electrical capacitance?,Science & Nature,medium,Farad
Who was the only god from Greece who did not get a name change in Rome?,Mythology,easy,Apollo
The character Momonga from the Overlord series orders his servants to call him by what name?,Entertainment: Japanese Anime & Manga,medium,Ainz Ooal Gown
"If he was still alive, in what year would Elvis Presley celebrate his 100th birthday?",Celebrities,medium,2035
"In Danganronpa: Trigger Happy Havoc, what is the protagonists name?",Entertainment: Video Games,easy,Makoto Naegi
"In the 2002 video game Kingdom Hearts, how many playable worlds were there?",Entertainment: Video Games,medium,14
What was the worlds first video game?,Entertainment: Video Games,hard,Tennis for Two
What major programming language does Unreal Engine 4 use?,Science: Computers,hard,C++
What is the name of the villian in the 2015 Russian-American Sci-Fi Movie Hardcore Henry?,Entertainment: Film,medium,Akan
"If a 360 no-scope is one full rotation before shooting, how many rotations would a 1080 no-scope be?",Entertainment: Video Games,easy,3
Where are the cars of the brand Ferrari manufactured?,Vehicles,easy,Italy
In what year was the video game company Electronic Arts founded?,History,medium,1982
In what year did Neil Armstrong and Buzz Aldrin land on the moon?,History,medium,1969
What does TIE stand for in reference to the TIE Fighter in Star Wars?,Entertainment: Film,medium,Twin Ion Engine
Whose greyscale face is on the kappa emoticon on Twitch?,General Knowledge,medium,Josh DeSeno
The Day the Music Died was a tragic plane crash that killed three musicians in which decade?,Entertainment: Music,medium,50s
Which of the following are cells of the adaptive immune system?,Science & Nature,hard,Cytotoxic T cells
Who voices for Ruby in the animated series RWBY?,Entertainment: Cartoon & Animations,easy,Lindsay Jones
What is isobutylphenylpropanoic acid more commonly known as?,Science & Nature,hard,Ibuprofen
The Hagia Sophia was commissioned by which emperor of the Byzantine Empire?,History,hard,Justinian I
"At which university do The Big Bang Theory characters Mr. Wolowitz and Drs. Cooper, Hofstadter and Koothrappali work?",Entertainment: Television,medium,Caltech
Which of these characters from Final Fantasy VIII primarily spoke in one word sentences?,Entertainment: Video Games,hard,Fujin
Which pulp hero made appearances in Hellboy and BPRD comics before getting his own spin-off?,Entertainment: Comics,hard,Lobster Johnson
What is the star sign of someone born on Valentines day?,General Knowledge,medium,Aquarius
Which movie served as the KTMA pilot episode for the show Mystery Science Theater 3000?,Entertainment: Television,medium,The Green Slime
Which country drives on the left side of the road?,General Knowledge,medium,Japan
"The two main characters of No Game No Life, Sora and Shiro, together go by what name?",Entertainment: Japanese Anime & Manga,easy,Blank
Which race in Guild Wars 2 believes in the Eternal Alchemy?,Entertainment: Video Games,easy,Asura
Who is the protagonist of the book: The Catcher in the Rye by J.D. Salinger,Entertainment: Books,medium,Holden Caulfield
Twenty One Pilots made the song The Motion featuring Sampha.,Entertainment: Music,medium,False
The creator of the Enigma Cypher and Machine was of what nationality?,History,medium,German
Solid Snake is actually a clone from the DNA of Big Boss in the Metal Gear Solid series history.,Entertainment: Video Games,easy,True
"The name of the main character of the video game The Legend of Zelda, is Zelda.",Entertainment: Video Games,easy,False
Who was the original voice actor of Shaggy Rogers in Scooby-Doo?,Entertainment: Television,medium,Casey Kasem
"What was the nickname given to the Hughes H-4 Hercules, a heavy transport flying boat which achieved flight in 1947?",General Knowledge,easy,Spruce Goose
Who voices the character Vernon Cherry in Red Dead Redemption?,Entertainment: Video Games,medium,Casey Mongillo
The Southeast Asian island of Borneo is politically divided among 3 countries.,Geography,medium,True
Which of the following games has the largest map size?,Entertainment: Video Games,easy,Just Cause 2
Which of these names are not a character of JoJos Bizarre Adventure?,Entertainment: Japanese Anime & Manga,hard,JoJo Kikasu
Which of these countries is not a United Nations member state?,Geography,medium,Niue
"In 2014, this new top 100 rapper who featured in Computers and Body Dance was arrested in a NYPD sting for murder.",Celebrities,medium,Bobby Shmurda
"The New York Times slogan is, “All the News That’s Fit to…”",General Knowledge,easy,Print
Whats the weakness of american vampires (Scott Snyders American Vampire)?,Entertainment: Comics,medium,Gold
"In Call Of Duty: Zombies, which maps opening cutscene shows Richtofen killing another version of himself?",Entertainment: Video Games,hard,The Giant
Who was the first explorer to sail to North America?,History,medium,Leif Erikson
Which one of these films are shot entirely in one-take?,Entertainment: Film,medium,Russian Ark
Which of these animals is NOT a lizard?,Animals,hard,Tuatara
"What was the original release date of Grand Theft Auto V?,Entertainment: Video Games",medium,September 17, 2013
Who is the main character in most of the games of the YS series?,Entertainment: Video Games,medium,Adol Christin
Which member of The Beatles narrated episodes of Thomas the Tank Engine?,Entertainment: Music,medium,Ringo Starr
Which is the second largest native language spoken in Spain by numbers of speakers?,General Knowledge,easy,Catalan
"When someone is cowardly, they are said to have what color belly?",General Knowledge,easy,Yellow
During the Wars of the Roses (1455 - 1487) which Englishman was dubbed the Kingmaker?,History,hard,Richard Neville
"In Formula 1, the Virtual Safety Car was introduced following the fatal crash of which driver?",Sports,medium,Jules Bianchi
Carcassonne is based on which French town?,Entertainment: Board Games,easy,Carcassonne
"To which biological phylum do all mammals, birds and reptiles belong?",Animals,hard,Chordata
The map featured in Arma 3 named Altis is based off of what Greek island?,Entertainment: Video Games,hard,Lemnos
"In the Pikmin games, which of the following pikmin colors lacks its own Onion nest?",Entertainment: Video Games,hard,Purple
The character that would eventually become Dr. Eggman was considered for the role of Segas new flagship mascot before Sonic was.,Entertainment: Video Games,medium,True
The Squaring the Circle problem is solvable.,Science: Mathematics,easy,False
The series of the Intel HD graphics generation succeeding that of the 5000 and 6000 series (Broadwell) is called:,Science: Computers,easy,HD Graphics 500
What is the original name of Final Fantasy XV?,Entertainment: Video Games,medium,Final Fantasy Versus XIII
Which of the following sports is not part of the triathlon?,Sports,easy,Horse-Riding
"In Big Hero 6, what were Baymaxs motions modeled after?",Entertainment: Film,hard,Baby penguins
"In Jurassic World, what is the name of the dinosaur that is a genetic hybrid?",Entertainment: Film,easy,Indominus Rex
"What was the code name for the Allied invasion of Southern France on August 15th, 1944?",History,hard,Operation Dragoon
Which team won the first Overwatch League championship?,Entertainment: Video Games,medium,London Spitfire
"In the Morse code, which letter is indicated by 3 dots? ",General Knowledge,medium,S
Which rock band released the album The Bends in March 1995?,Entertainment: Music,medium,Radiohead
In which series of games do you collect souls to empower you and buy weaponry and armor with?,Entertainment: Video Games,easy,Souls
Approximately what percentage of Earths atmosphere is Oxygen?,Science & Nature,medium,21%
"In the Lord of the Rings, who is the father of the dwarf Gimli?",Entertainment: Books,medium,Gloin
Where is the train station Llanfair­pwllgwyngyll­gogery­chwyrn­drobwll­llan­tysilio­gogo­goch?,General Knowledge,easy,Wales
Which gaming series includes The Diabolical Box and The Curious Village?,Entertainment: Video Games,hard,Professor Layton
Who is the chemical element Curium named after?,Science & Nature,easy,Marie & Pierre Curie
Which famous spy novelist wrote the childrens story Chitty-Chitty-Bang-Bang?,Entertainment: Books,easy,Ian Fleming
Computer manufacturer Compaq was acquired for $25 billion dollars in 2002 by which company?,General Knowledge,medium,Hewlett-Packard
Which of these is a semiconductor amplifying device?,Science & Nature,hard,transistor
Which of the following cellular device companies is NOT headquartered in Asia?,Science: Gadgets,hard,Nokia
"Which cartoon family lives in 742 Evergreen Terrace, Springfield USA?",Entertainment: Cartoon & Animations,easy,The Simpsons
There arent any live-action clones in Star Wars: Episode III - Revenge of the Sith.,Entertainment: Film,medium,True
Which countries participated in the Lobster War?,History,hard,France and Brazil
Minecraft can be played with a virtual reality headset.,Entertainment: Video Games,easy,True
Which band is the longest active band in the world with no breaks or line-up changes?,Entertainment: Music,hard,U2
Who Voices the Devil on Devils Flight in Final Destination 3?,Entertainment: Film,hard,Tony Todd
"In the Toaru Majutsu no Index anime, Touma Kamijou is a level 0 esper that has the ability to do what?",Entertainment: Japanese Anime & Manga,medium,Dispell any esper or magical powers
The medial meniscus forms which part of what joint in the human body?,Science & Nature,medium,Knee
"In Sonic the Hedgehog 3 for the Sega Genesis, what is the color of the second Chaos Emerald you can get from Special Stages?",Entertainment: Video Games,hard,Orange
Who was walking like an Egyptian in 1981?,Entertainment: Music,medium,The Bangles
"In Kendrick Lamars 2012 album, Good Kid, M.A.A.D City, the albums story takes place in which city?",Entertainment: Music,hard,Compton
"What happened to Half-Life 2 prior to its release, which resulted in Valve starting over the development of the game?",Entertainment: Video Games,medium,The source code got leaked
"In Highschool of the Dead, where did Komuro and Saeko establish to meet after the bus explosion?",Entertainment: Japanese Anime & Manga,hard,Eastern Police Station
Under what pseudonym did Stephen King publish five novels between 1977 and 1984?,Entertainment: Books,easy,Richard Bachman
"In the 1969 Cartoon show Dastardly and Muttley in Their Flying Machines, which were NOT one of the lyrics in the opening theme?",Entertainment: Cartoon & Animations,hard,Stab him
"In Forza Motorsport 6, which of these track-exclusive cars was NOT featured in the game, either originally with the game or added as DLC?",Entertainment: Video Games,medium,Aston Martin Vulcan
"Along with Gabe Newell, who co-founded Valve?",Entertainment: Video Games,medium,Mike Harrington
What was the name of the first front-wheel-drive car produced by Datsun (now Nissan)?,Vehicles,hard,Cherry
"Which nation claims ownership of Antarctica?,Geography",easy,No one, but there are claims.
Deuterium is an isotope of which element?,Science & Nature,medium,Hydrogen
Montreal is in which Canadian province?,Geography,medium,Quebec
"In a 1994 CBS interview, Microsoft co-founder Bill Gates performed what unusual trick on camera?",General Knowledge,medium,Jumping over an office chair
Which of the following is considered classical conditioning?,Science & Nature,hard,Pavlovs dog experiments
"In Portal 2, which solar system body did Wheatley end up orbiting?",Entertainment: Video Games,medium,The moon
What two characters from the game Undertale are never in a relationship or not related?,Entertainment: Video Games,medium,Frisk & Chara
"In Super Mario 64, collecting 100 coins on a level will give you a 1-UP.",Entertainment: Video Games,easy,False
"In the videogame Bully, what is the protagonists last name?",Entertainment: Video Games,easy,Hopkins
At which bridge does the annual Oxford and Cambridge boat race start?,Sports,medium,Putney
The “fairy” type made it’s debut in which generation of the Pokemon core series games?,General Knowledge,easy,6th
In the 1979 British film Quadrophenia what is the name of the seaside city the mods are visiting?,Entertainment: Film,medium,Brighton
"In Star Trek, Klaang is a typical Klingon male.",Entertainment: Television,easy,True
Pol Pot was the former dictator of which country?,History,easy,Cambodia
What is the highest belt you can get in Taekwondo?,Sports,medium,Black
The ultimate phrase used by Pharah from Overwatch is: Justice rains from above!,Entertainment: Video Games,easy,True
"Which car tire manufacturer is famous for its Eagle brand of tires, and is the official tire supplier of NASCAR?",Vehicles,easy,Goodyear
Which King of England was faced with the Peasants Revolt in 1381?,History,hard,Richard II
Which of the following anime of the mecha genre began airing in 1982?,Entertainment: Japanese Anime & Manga,medium,The Super Dimension Fortress Macross
"In Call Of Duty: Zombies, you can upgrade the Apothicon Servant in the Shadows Of Evil map.",Entertainment: Video Games,medium,False
Which Native American tribe/nation requires at least one half blood quantum (equivalent to one parent) to be eligible for membership?,Politics,hard,Yomba Shoshone Tribe
What is the name of Sherlock Holmess brother?,Entertainment: Books,easy,Mycroft Holmes
"In programming, the ternary operator is mostly defined with what symbol(s)?",Science: Computers,medium,?:
Which of the following is not the name of a Bond Girl? ,Entertainment: Film,easy,Vanessa Kensington
"When was the Valve Corporation founded?,Entertainment: Video Games",hard,August 24, 1996
Kanye West at 2009 VMAs interrupted which celebrity?,Entertainment: Music,easy,Taylor Swift
Which group performs the song Crash into Me?,Entertainment: Music,easy,Dave Matthews Band
Italy and Ireland are the only countries in Europe that start with the letter I.,Geography,medium,False
Who played Baron Victor Frankestein in the 1957 Hammer horror film The Curse of Frankenstein?,Entertainment: Film,medium,Peter Cushing
"In computing terms, typically what does CLI stand for?",Science: Computers,medium,Command Line Interface
"Like his character in Parks and Recreation, Aziz Ansari was born in South Carolina.",Entertainment: Television,medium,True
This composer worked on the 2003 TV series Battlestar Galatica.,Entertainment: Television,medium,Bear McCreary
Minecraft can be played with a virtual reality headset.,Entertainment: Video Games,easy,True
What is the smallest country in the world?,Geography,easy,Vatican City
What is the first Mersenne prime exponent over 1000?,Science: Mathematics,medium,1279
In which year did Caravan Palace release their first album?,Entertainment: Music,medium,2008
In which country is the city of Rio de Janeiro?,Geography,easy,Brazil
Who is the dumb blonde character in Nickelodeons The Loud House?,Entertainment: Cartoon & Animations,medium,Leni
"In The Amazing World of Gumball, who is the principal of Elmore Junior High?",Entertainment: Cartoon & Animations,medium,Principal Brown
"In Naruto: Shippuden, which of the following elements is a Kekkei Tōta?",Entertainment: Television,medium,Particle Style
African-American performer Sammy Davis Jr. was known for losing which part of his body in a car accident?,Entertainment: Music,medium,Left Eye
"In the S.T.A.L.K.E.R. series, the Freedom faction wishes to destroy the supernatural area known as  the Zone.",Entertainment: Video Games,easy,False
"In Magic: The Gathering, which of the following was the first publicly released foil card?",Entertainment: Board Games,hard,Lightning Dragon
"What is the name of the formerly rich fishing grounds off the island of Newfoundland, Canada?",Geography,hard,Grand Banks
Which is the largest city in Morocco?,Geography,medium,Casablanca
Which Twitch streamer is the vocalist for Red Vox?,Entertainment: Music,easy,Vinesauce
"Dallon Weekes, former touring basist of Panic! At the Disco, created his own band in 2016 called...",Entertainment: Music,hard,I Dont Know How But They Found Me
"Originally, the character Charlie from Charlie and the Chocolate Factory was going to be black.",Entertainment: Books,medium,True
